{
  "schemaVersion": 1,
  "protocolVersion": 0,
  "provider": {
    "slug": "teleagent",
    "name": "TeleAgent",
    "accent": "#4ee3c0",
    "order": 50
  },
  "model": {
    "slug": "pro",
    "name": "TeleAgent Pro",
    "order": 1
  },
  "demo": {
    "title": "以太冲刺 · AETHER DASH",
    "tag": "AETHER"
  }
}
