{
  "schemaVersion": 1,
  "protocolVersion": 1,
  "provider": {
    "slug": "openai",
    "name": "OpenAI",
    "accent": "#10A37F",
    "order": 1000
  },
  "model": {
    "slug": "gpt-5.5-high",
    "name": "openai/gpt-5.5-high",
    "order": 1000
  },
  "demo": {
    "title": "星轨疾跑",
    "tag": "完整跑酷"
  }
}
