{
  "schemaVersion": 1,
  "protocolVersion": 0,
  "provider": {
    "slug": "meta",
    "name": "Meta",
    "accent": "#a890ff",
    "order": 30
  },
  "model": {
    "slug": "muse-spark-1.3",
    "name": "Muse Spark 1.3",
    "order": 10
  },
  "demo": {
    "title": "星尘酷跑 · STAR DASH RUNNER",
    "tag": "STAR"
  }
}
