{
  "schemaVersion": 1,
  "protocolVersion": 1,
  "provider": {
    "slug": "openai",
    "name": "OpenAI",
    "accent": "#6fe7ff",
    "order": 10
  },
  "model": {
    "slug": "gpt-5.6-sol-pro",
    "name": "GPT-5.6 Pro",
    "order": 1000
  },
  "demo": {
    "title": "光潮跃迁 · LUMEN TIDE",
    "tag": "潮汐变轨跑酷"
  }
}
